{
  "ambiguous_ball_frames": 1,
  "analysis_window_fingerprint": "9408075b76e7d881581506c47d20a5345469843ed7b6d508f288be516b683676",
  "assigned_detection_count": 15,
  "ball_config_fingerprint": "bbbbbbbbbbbbbbbbbbbbbbbbbbbbbbbbbbbbbbbbbbbbbbbbbbbbbbbbbbbbbbbb",
  "ball_input_detection_count": 8,
  "ball_track_count": 1,
  "completed_at_utc": "2026-07-23T15:31:57.536242Z",
  "config_fingerprint": "4c6c602e4ecff19bbb5a0821a360f2445842939664774877b96262c8bd6d020a",
  "confirmed_count": 2,
  "cross_cut_violation_count": 0,
  "detection_bundle_fingerprint": "bf86e658a9a2c9e4ad4550326cc0923860c1c964f283fcbad9ed4f9bcf062140",
  "detection_config_fingerprint": "aaaaaaaaaaaaaaaaaaaaaaaaaaaaaaaaaaaaaaaaaaaaaaaaaaaaaaaaaaaaaaaa",
  "duplicate_count": 0,
  "errors": [],
  "fragmentation_count": 0,
  "ground_truth_evaluation_status": "NOT_EVALUATED_NO_REVIEWED_TRACKING_GROUND_TRUTH",
  "human_config_fingerprint": "bbbbbbbbbbbbbbbbbbbbbbbbbbbbbbbbbbbbbbbbbbbbbbbbbbbbbbbbbbbbbbbb",
  "human_input_detection_count": 8,
  "human_track_count": 1,
  "inputs": {
    "ball_observations": "ball_observations.parquet",
    "ball_receipt": "ball_receipt.json",
    "detection_attributes": "detection_attributes.parquet",
    "detection_receipt": "detection_receipt.json",
    "detections": "detections.parquet",
    "human_observations": "human_observations.parquet",
    "human_receipt": "human_receipt.json"
  },
  "interpolated_count": 0,
  "invalid_fk_count": 0,
  "lost_count": 0,
  "no_candidate_ball_frames": 1,
  "observed_count": 15,
  "output_hashes": {
    "ball_primary_candidates_sha256": "7b31e71d88cb10a34077482fbd90e072715a7063e4e93c23c7266b54e6a5b2d8",
    "ball_primary_candidates_size_bytes": "1364",
    "track_lifecycle_sha256": "314fc77f4114d38f4b61df16d82bd151e6cc1e270bb9c744253b97c3b0711011",
    "track_lifecycle_size_bytes": "6578",
    "track_observations_sha256": "d06f398aed0bc49a9a24702194df03a10344d1a7d0c169a9a58422cd2e9dea63",
    "track_observations_size_bytes": "5852",
    "track_summaries_sha256": "3e4dae11007edccbb6e2ad47759f12e6e862809c9f580ec42f0b3cb769da74e0",
    "track_summaries_size_bytes": "5126"
  },
  "outputs": {
    "ball_primary_candidates": "ball_primary_candidates.json",
    "review_queue": "review_queue.json",
    "track_lifecycle": "track_lifecycle.parquet",
    "track_observations": "track_observations.parquet",
    "track_summaries": "track_summaries.parquet",
    "tracking_bundle_manifest": "tracking_bundle_manifest.json",
    "tracking_quality_report": "tracking_quality_report.json"
  },
  "pipeline_id": "tracking_fusion_baseline",
  "pipeline_version": "1.0.0",
  "predicted_count": 1,
  "primary_ball_frames": 6,
  "provenance": {
    "ball_not_evaluated_code": "NOT_EVALUATED_NO_REVIEWED_BALL_TRACKING_GROUND_TRUTH",
    "human_not_evaluated_code": "NOT_EVALUATED_NO_REVIEWED_HUMAN_TRACKING_GROUND_TRUTH",
    "id_remap_count": 1,
    "label": "tracking_fusion",
    "no_human_ball_relationship_table": true,
    "no_reid": true,
    "primary_ball_not_identity": true,
    "receipt_fingerprint": "7630809ab64c23996a4b7279437c174e812d285a2f24e111c5112dd461ff4e54",
    "stage": "6D",
    "track_id_is_player_identity": false,
    "tracking_not_evaluated_code": "NOT_EVALUATED_NO_REVIEWED_TRACKING_GROUND_TRUTH"
  },
  "quality_gate_status": "pass_with_findings",
  "receipt_id": "trk_pipe_run_20260723T153",
  "recovery_count": 2,
  "review_required_count": 3,
  "role_abstention_count": 4,
  "run_id": "run_20260723T153157218262Z_fdcb3b1b8e28",
  "schema_version": 1,
  "source_video_sha256": "aaaaaaaaaaaaaaaaaaaaaaaaaaaaaaaaaaaaaaaaaaaaaaaaaaaaaaaaaaaaaaaa",
  "started_at_utc": "2026-07-23T15:31:57.204100Z",
  "status": "succeeded",
  "tentative_count": 0,
  "terminated_count": 0,
  "timeline_fingerprint": "b3ebba1703857928f7b72b0bb17d4eb9d463af19757e3681dd7a95ae6abeb690",
  "total_track_count": 2,
  "unassigned_detection_count": 1,
  "video_id": "video_01",
  "warnings": [
    {
      "code": "NOT_EVALUATED_NO_REVIEWED_TRACKING_GROUND_TRUTH",
      "message": "NOT_EVALUATED_NO_REVIEWED_TRACKING_GROUND_TRUTH"
    }
  ]
}
